{
  "schema": "qlkg-local-profile-v1",
  "database": "knowledge.sqlite",
  "portable_store": "/synthetic/private-store",
  "embedding_profile": "primary",
  "provider_profiles": {
    "primary": {
      "adapter": "fixture-adapter",
      "model": "synthetic-model",
      "dimensions": 8,
      "base_url": "https://example.invalid/v1",
      "credential_env": "SYNTHETIC_EMBEDDING_KEY"
    }
  }
}
